[
  {
    "cell_context": {
      "cell_composition_estimates": [],
      "cell_line_cellosaurus_candidate": null,
      "cell_state": null,
      "cell_type_or_line_raw": null,
      "co_culture_partners": [],
      "context_kind": "unclear",
      "developmental_stage": null,
      "engineered_modifications": [],
      "passage_or_state": null,
      "sort_markers": [],
      "subcellular_fraction": null,
      "tissue": null,
      "tissue_segment": null
    },
    "disease_state": {
      "mesh_id_candidate": null,
      "status": "none",
      "term_raw": null
    },
    "extraction": {
      "ambiguity_flags": [
        "description_too_short",
        "control_unspecified"
      ],
      "confidence": 0.85,
      "model": "openai:gpt-5.5",
      "raw_input_hash": "sha256:e2b7865e2873cea07a905320a095f4985fa23fb8804e83ebc76a676f53bf8832",
      "schema_version": "stage1.v3"
    },
    "geo_accession": "GSM2676366",
    "host_organism": null,
    "organism": null,
    "patient_metadata": null,
    "perturbations": [
      {
        "agent_normalized": {
          "collection": null,
          "id": null,
          "id_database": null,
          "preferred_name": null,
          "type": "none"
        },
        "agent_raw": "control",
        "dose": {
          "unit": null,
          "value_numeric": null,
          "value_raw": null
        },
        "duration": {
          "is_zero_timepoint": false,
          "value_hours": null,
          "value_raw": null
        },
        "is_negative_control": true,
        "kind": "none",
        "mediated_effect": null,
        "phase": null,
        "temporal_order": null
      }
    ],
    "series_id": "GSE100261",
    "technical_treatments": []
  },
  {
    "cell_context": {
      "cell_composition_estimates": [],
      "cell_line_cellosaurus_candidate": null,
      "cell_state": null,
      "cell_type_or_line_raw": null,
      "co_culture_partners": [],
      "context_kind": "unclear",
      "developmental_stage": null,
      "engineered_modifications": [],
      "passage_or_state": null,
      "sort_markers": [],
      "subcellular_fraction": null,
      "tissue": null,
      "tissue_segment": null
    },
    "disease_state": {
      "mesh_id_candidate": null,
      "status": "none",
      "term_raw": null
    },
    "extraction": {
      "ambiguity_flags": [
        "description_too_short",
        "control_unspecified"
      ],
      "confidence": 0.88,
      "model": "openai:gpt-5.5",
      "raw_input_hash": "sha256:e2b7865e2873cea07a905320a095f4985fa23fb8804e83ebc76a676f53bf8832",
      "schema_version": "stage1.v3"
    },
    "geo_accession": "GSM2676367",
    "host_organism": null,
    "organism": null,
    "patient_metadata": null,
    "perturbations": [
      {
        "agent_normalized": {
          "collection": null,
          "id": null,
          "id_database": null,
          "preferred_name": null,
          "type": "none"
        },
        "agent_raw": "control",
        "dose": {
          "unit": null,
          "value_numeric": null,
          "value_raw": null
        },
        "duration": {
          "is_zero_timepoint": false,
          "value_hours": null,
          "value_raw": null
        },
        "is_negative_control": true,
        "kind": "none",
        "mediated_effect": null,
        "phase": null,
        "temporal_order": null
      }
    ],
    "series_id": "GSE100261",
    "technical_treatments": []
  },
  {
    "cell_context": {
      "cell_composition_estimates": [],
      "cell_line_cellosaurus_candidate": null,
      "cell_state": null,
      "cell_type_or_line_raw": null,
      "co_culture_partners": [],
      "context_kind": "unclear",
      "developmental_stage": null,
      "engineered_modifications": [],
      "passage_or_state": null,
      "sort_markers": [],
      "subcellular_fraction": null,
      "tissue": null,
      "tissue_segment": null
    },
    "disease_state": {
      "mesh_id_candidate": null,
      "status": "none",
      "term_raw": null
    },
    "extraction": {
      "ambiguity_flags": [
        "missing_dose",
        "missing_duration",
        "description_too_short"
      ],
      "confidence": 0.86,
      "model": "openai:gpt-5.5",
      "raw_input_hash": "sha256:1adcd8317a6cba01a964bc3bd771ba235b93d41ee149ce4d8ab3105bc96f4122",
      "schema_version": "stage1.v3"
    },
    "geo_accession": "GSM2676368",
    "host_organism": null,
    "organism": null,
    "patient_metadata": null,
    "perturbations": [
      {
        "agent_normalized": {
          "collection": null,
          "id": null,
          "id_database": "HGNC",
          "preferred_name": "MTHFD2",
          "type": "gene_or_protein"
        },
        "agent_raw": "MTHFD2 siRNA",
        "dose": {
          "unit": null,
          "value_numeric": null,
          "value_raw": null
        },
        "duration": {
          "is_zero_timepoint": false,
          "value_hours": null,
          "value_raw": null
        },
        "is_negative_control": false,
        "kind": "genetic_knockdown",
        "mediated_effect": null,
        "phase": null,
        "temporal_order": null
      }
    ],
    "series_id": "GSE100261",
    "technical_treatments": []
  },
  {
    "cell_context": {
      "cell_composition_estimates": [],
      "cell_line_cellosaurus_candidate": null,
      "cell_state": null,
      "cell_type_or_line_raw": null,
      "co_culture_partners": [],
      "context_kind": "unclear",
      "developmental_stage": null,
      "engineered_modifications": [],
      "passage_or_state": null,
      "sort_markers": [],
      "subcellular_fraction": null,
      "tissue": null,
      "tissue_segment": null
    },
    "disease_state": {
      "mesh_id_candidate": null,
      "status": "none",
      "term_raw": null
    },
    "extraction": {
      "ambiguity_flags": [
        "missing_dose",
        "missing_duration",
        "description_too_short"
      ],
      "confidence": 0.86,
      "model": "openai:gpt-5.5",
      "raw_input_hash": "sha256:1adcd8317a6cba01a964bc3bd771ba235b93d41ee149ce4d8ab3105bc96f4122",
      "schema_version": "stage1.v3"
    },
    "geo_accession": "GSM2676369",
    "host_organism": null,
    "organism": null,
    "patient_metadata": null,
    "perturbations": [
      {
        "agent_normalized": {
          "collection": null,
          "id": null,
          "id_database": "HGNC",
          "preferred_name": "MTHFD2",
          "type": "gene_or_protein"
        },
        "agent_raw": "MTHFD2 siRNA",
        "dose": {
          "unit": null,
          "value_numeric": null,
          "value_raw": null
        },
        "duration": {
          "is_zero_timepoint": false,
          "value_hours": null,
          "value_raw": null
        },
        "is_negative_control": false,
        "kind": "genetic_knockdown",
        "mediated_effect": null,
        "phase": null,
        "temporal_order": 1
      }
    ],
    "series_id": "GSE100261",
    "technical_treatments": []
  },
  {
    "cell_context": {
      "cell_composition_estimates": [],
      "cell_line_cellosaurus_candidate": null,
      "cell_state": null,
      "cell_type_or_line_raw": null,
      "co_culture_partners": [],
      "context_kind": "unclear",
      "developmental_stage": null,
      "engineered_modifications": [],
      "passage_or_state": null,
      "sort_markers": [],
      "subcellular_fraction": null,
      "tissue": null,
      "tissue_segment": null
    },
    "disease_state": {
      "mesh_id_candidate": null,
      "status": "none",
      "term_raw": null
    },
    "extraction": {
      "ambiguity_flags": [
        "missing_dose",
        "missing_duration"
      ],
      "confidence": 0.95,
      "model": "openai:gpt-5.5",
      "raw_input_hash": "sha256:1adcd8317a6cba01a964bc3bd771ba235b93d41ee149ce4d8ab3105bc96f4122",
      "schema_version": "stage1.v3"
    },
    "geo_accession": "GSM2676370",
    "host_organism": null,
    "organism": null,
    "patient_metadata": null,
    "perturbations": [
      {
        "agent_normalized": {
          "collection": null,
          "id": null,
          "id_database": "HGNC",
          "preferred_name": "MTHFD2",
          "type": "gene_or_protein"
        },
        "agent_raw": "MTHFD2 siRNA",
        "dose": {
          "unit": null,
          "value_numeric": null,
          "value_raw": null
        },
        "duration": {
          "is_zero_timepoint": false,
          "value_hours": null,
          "value_raw": null
        },
        "is_negative_control": false,
        "kind": "genetic_knockdown",
        "mediated_effect": null,
        "phase": "exposure",
        "temporal_order": null
      }
    ],
    "series_id": "GSE100261",
    "technical_treatments": []
  }
]
