{
  "geo_accession": "GSM1009635",
  "series_id": "GSE41166",
  "organism": "Homo sapiens",
  "host_organism": null,
  "cell_context": {
    "cell_type_or_line_raw": "Primary Human Umbilical Vein Endothelial Cells",
    "cell_line_cellosaurus_candidate": null,
    "tissue": "vascular endothelium",
    "tissue_segment": null,
    "passage_or_state": "P3-6",
    "context_kind": "primary_culture",
    "developmental_stage": null,
    "cell_state": null,
    "subcellular_fraction": null,
    "engineered_modifications": [],
    "co_culture_partners": [],
    "sort_markers": [],
    "cell_composition_estimates": []
  },
  "disease_state": {
    "term_raw": null,
    "mesh_id_candidate": null,
    "status": "none"
  },
  "perturbations": [
    {
      "kind": "cytokine_stimulation",
      "agent_raw": "VEGF",
      "agent_normalized": {
        "type": "gene_or_protein",
        "id_database": "HGNC",
        "id": "HGNC:12680",
        "preferred_name": "VEGFA",
        "collection": null
      },
      "dose": { "value_raw": null, "value_numeric": null, "unit": null },
      "duration": { "value_raw": "0h", "value_hours": 0, "is_zero_timepoint": true },
      "phase": null,
      "temporal_order": null,
      "is_negative_control": false,
      "mediated_effect": null
    }
  ],
  "technical_treatments": [],
  "patient_metadata": null,
  "extraction": {
    "schema_version": "stage1.v3",
    "model": "openai:gpt-5.5",
    "confidence": 0.78,
    "ambiguity_flags": [],
    "raw_input_hash": "sha256:0000000000000000000000000000000000000000000000000000000000000000"
  }
}
